<?xml version="1.0" ?>
<!DOCTYPE remote SYSTEM "remote.dtd">

<remote id="RM-0010">
	<name>Leadtek CoolCommand RM-0010</name>
	<author>Zsolt Rizsanyi</author>
	<button id="0" class="number" parameter="0"/>
	<button id="1" class="number" parameter="1"/>
	<button id="2" class="number" parameter="2"/>
	<button id="3" class="number" parameter="3"/>
	<button id="4" class="number" parameter="4"/>
	<button id="5" class="number" parameter="5"/>
	<button id="6" class="number" parameter="6"/>
	<button id="7" class="number" parameter="7"/>
	<button id="8" class="number" parameter="8"/>
	<button id="9" class="number" parameter="9"/>
	<button id="POWER" class="off"><name>Power</name></button>
	<button id="TV/FM"><name>TV/FM</name></button>
	<button id="SCAN" class="scan"><name>Scan</name></button>
	<button id="DISPLAY"><name>Display</name></button>
	<button id="RECALL" class="recall"><name>Recall</name></button>
	<button id="ENTER" class="enter"><name>Enter</name></button>
	<button id="CC" class="captions"><name>Closed Captions</name></button>
	<button id="MTS"><name>MTS</name></button>
	<button id="FINE_DOWN" class="finetunedown"><name>Fine Tune Down</name></button>
	<button id="FINE_UP" class="finetuneup"><name>Fine Tune Up</name></button>
	<button id="VIDEO"><name>Video</name></button>
	<button id="MUTE" class="mute"><name>Mute</name></button>
	<button id="CH_UP" class="channelup"><name>Channel Up</name></button>
	<button id="CH_DOWN" class="channeldown"><name>Channel Down</name></button>
	<button id="VOL_UP" class="volumeup"><name>Volume Up</name></button>
	<button id="VOL_DOWN" class="volumedown"><name>Volume Down</name></button>
	<button id="FULLSCREEN" class="fullscreen"><name>Full Screen</name></button>
	<button id="SLEEP"><name>Sleep</name></button>
	<button id="BOSS_KEY"><name>Boss key</name></button>
	<button id="RED" class="red"><name>Red</name></button>
	<button id="GREEN" class="green"><name>Green</name></button>
	<button id="YELLOW" class="yellow"><name>Yellow</name></button>
	<button id="BLUE" class="blue"><name>Blue</name></button>
	<button id="PIP"><name>Pip</name></button>
	<button id="."><name>Dot (.)</name></button>
	<button id="BACK" class="previous"><name>Back</name></button>
	<button id="PLAY" class="play"><name>Play</name></button>
	<button id="NEXT" class="next"><name>Next</name></button>
	<button id="TIMESHIFT"><name>Timeshift</name></button>
	<button id="STOP" class="stop"><name>Stop</name></button>
	<button id="REC" class="record"><name>Record</name></button>
	<button id="SNAPSHOT"><name>Snapshot</name></button>
</remote>
